{
    "name": "Duolingo Kanji",
    "source": "https://www.duolingo.com/characters",
    "lang": "ja",
    "data": [
        [
            "Non-Duolingo Kanji",
            ""
        ],
        [
            "Section 1",
            "一二三山口田中"
        ],
        [
            "Section 2",
            "私東京都日本父母四五六七見読本時十八半九七六一三二古新百千水大小買土曜話日聞食飲新四時言行来分間十七四二時三何高山休九月日七休九物何買会金父母曜日月何時木卵魚曜日火山田何曜日水階書作四時間何九半人年生駅二一何四三雨川一日五月"
        ],
        [
            "Section 3",
            "先週明月日来家円前今安万日一夜外今学大木先生左右住四月夜一二車帰三月四日後今乗一分六中三飯電今週車八分来年末上五日週昨電話日毎十階日茶毎年入二日間十一月口北好今週末朝年毎入大好昼肉飯八午今月東後間痛目西四日間六階朝飯校回晩今七日六月飯海近八日多半分花色酒六日南十日学生後気場所少人語何人日本楽名前日店計使英僕野菜牛乳語四分社零風呂寝室台部屋会午前所庭窓子猫羽犬鳥椅机七二三歳阪国留健太直美個四二十何五百一八七九三六大外人学生中小高校彼誰姉女供妹弟兄族両親子家堂熱冷甘食仕事勉強友達忙日下横隣韓旅布団冊棚鏡産隅長片汚低蔵庫後国人行一時八本三十七土平洗濯掃除日一昨電映画手紙歌散歩絵音枚写真楽二十一五何百三四戚息娘孫夫妻祖在宅奥主親子六人千百九五八万十七三母父行飛機地鉄空港自転図遅速遠行下車近白赤黄靴青服黒帽欲色茶子公園緒館再練習料理一映画電話来週悪天晴曇夕雪暗方弱気大雨空明今晩朝昼間風強弁当全然果塩醤油砂糖結構変紅物夕飯部少酒大茶出建病院銀向道通口物入行店料理大小箸皿腹寿司碗好物本当茶去誕九日十一月昨年三二毎晩生週間再来鞄荷腕財他重軽丈切違同時計物布色夫大立派男皆勢婚有若離独身氏女方人子大結名赤彼暖寒暑傘次涼狭角広緑春夏紫足冬灰秋早袋携帯色三二靴下手台五池賑匹声動鹿静馬木十二一五八物三園上野牛宿題授業教科難易漢字葉意味辞書言菓唐揚内子袋少店質問答度定規簡単鉛筆教室題今何二一十本四三八五面愛怖暇持悲嬉白気親切分町門交番玄関廊戸村符段危橋運自動車図書館中手洗下切階所五転薄細厚丸鍵石鹸箱太紙鶏豚飴一番四何二三八牛肉制短袖革着浴衣背指輪洋服長半二三四広一帯物上号球走泳弾撮漫番字大丈夫野下手行読上見歌画来多分取文章雑誌返借貸作書歩買邪頭体薬医者鼻顔歯髪眼耳風背病気手鏡運動中太便利周辺外国語事旅館段一海始起立郵局包封筒届船更航配便切手葉書物小中身変住所出空達留伝説初心試合得勝負最苦者中意手渋谷原差点線市首座島民集数宿秋葉新交乗池袋山手近所人口大都銀広住場操陸選種柔卓銅属水泳体上手会場楽目道空球銀金踊直珍君発必要優音預開閉証用士記残支払現署領収替釣別金暗番号口座字紙持会計入高小切手名書両星陽浜湖草森濡浅深氷光波富太空気葉島辺生物火石山具無小説道両方使行読作泳書料金入場和注汁噌濃量客様湯予約勧食文苦味事質植染環境虫巨殺死生物人間地球汚全自然五頭四二子豚大野形格素普厳様子好晴通変美中甘最近悪新高値引小浜横機会名古屋必飲回周枝豆鮮腐蓋鍋材混瓶玉八百屋新乳細大作料理人固調比研究幅測的秤専攻化反応実験科学柔大深高長重者地質生物用意理変資源豊燃決懸命土地所有天然石油料開発取手当回一生件故因不助険逮捕突警察非常震床落救急事原明危大火然口地場合交通面売幹側終到拾席途性寄駐場新線急行点着間出発中女車両男年専用別育徒卒歴史成績締講義提準備教生業後中学校入小試験説明切書地理点出文医読席者合格独"
        ],
        [
            "Section 4",
            "給議刺複功訳続務失礼疲料会室名雑社長上司成売通下残業値段事所様増秒順割掛等算均占相数学三回十四二五百後年人時間引日足番少電卓合計派平多点当林景舎捨甥嬢姪枝色田義理家庭燃息子夢幸興遊涙流眺念趣目的味生行帰歩書安心嘘由秘密表心意見人生自分単語現言搭券観路進切乗光客入国便手続中機内通荷物無事着陸離後成田苦時差師法律欠正対可能解位例典型教予習校長通席専門家分野関心事無科目不授理学文具体的神寺祈信仰宗仏存式葬魂坊滅社道教会人院徒在結婚天国不絶想像確力反対語返事派伝理由上明立可能性喉肘眠肩血骨膝射康臓脳首腕調子指身長注健体重力歯医者心病握老焼巻軍艦刺身海回転部分手的皇象徴世界戦争経済活組県元受付価国家天平和両的社会学中文化行動者番千葉独立明進歩計画地物裏工貧類談代許挨拶則暮刻信号赤駐車場歩道乗客運物港船書相無理可続規遅用事的寂恋精冗情係互胸怒恐触恥驚不安眠心配神的談愛得自信関個人際統政治張案府員投票改挙批判国大領的主首相語提使館市民家議会革選制度舞芸術俳劇感監督拍詩品視偉演役壁作家台絵画一種女優動的手歌人筆場観客線大面割美館泥棒特久振過前回別運転間北海道大事返時代新去断丘列噴漠沖縄方向日本海砂横島火山太平洋活大部分表面陸地刑逃犯罪護裁訴官務所人重大殺弁士判公平有確定無決報季節雲稲雷温示域乾燥蒸候猛烈霧予一時的現象妻雨台風度気地計暑暖化戻越以全員正午予定年間引足見物下上器麦粉加残天注食焼油電子小揚兵敵激盾剣困武撃渉紛士大戦命器収勝利攻解決交中両国外争津災害被洪嵐犠牲伴破壊停避消防鳴波大水地方者電難所広残車明士発生警報署火告状宣脱囚為拠論被白終身刑死人違法捕走行者罪裏付証事実言議根賃井居磨覚畳香納整臭置余毛枕車庫家具屋天一面間寝坊育歯粉目時計地下室豆理分布元腕責任怠担努駄喫煙禁共求安全確義務的当真面目番者力家分終事無公飲酒要説得訪未認博将守期来確物館世話再日付時次回都合迷惑是協止丁寧儀願申慮手数案内非力中本日辞握者遠連絡敗職己紹介我税輸貿失情報業大自最産生量収入金出易相手頂塔郷郊距街谷上川平国境真中大都会北東恋故西外南迷子離界線心地部位置株唯億硬貨札保契貯営勘乏大金市場式約投資財産一全無利子人険発行証借書業定貧党補就臣知総催法案市役所可決次大政国会候者辞任長指名立事首脳理開地演説談咳患睡傷妊娠舌肺肌復爪尻毒頭痛者眠薬体温手術中首後回腹車椅子食消化泊泉貴宿何名四温三過朝食和室休暇号一昼料先重品金庫夕詳放送査述噂発表報道記者事結果正直再調員意外無知銃矢弓基衛隊爆競率暴訓地自員弾争年手段敵軍力事発練滞各渡標識免延効限渋通道路高速改札過列車口白線駅在地行止停無視歩者更新警察官許証決定遠足長有期筋汗鍛憩姿裸伏肉痛和持上体力合定期休的育館腹格息勢出更衣室二頭胸強化見王思魔杖勇妖城姫怪幽霊竜鬼河童子女不議様国要法使気精者化械販技充印刷削障電子自動的機利用法波売不便洗濯音量作成現代術者画像鮮明面夢中池撮除球故調節完哲権待況考賛尊全主義者反体制民党化姿博士号論文知識経験失学利期支持正確現在判断無意状平等方理的成基本重人喜祝贈祭良旗雰囲物行事花火素敵出来日常国気恐脚診症菌腰胃圧退看体調入院察状細流行感染者断書血米凍栄養抹餅含保存冷庫小豆白玄食欲和菓子伝統茶的好焼料品質不足豊快忘掌勤往頃粧州乗車券駅前優先足元席閉最下付近場特急速物精算路線図片道鉄通目的地運賃者復今革化室手北部西九南関減費贅沢製需商益見本販売中員古品車増加少消税価格手入独占上権特新供給要宣伝利景気与従労接僚編募働織設築履程年金業員退職後公務会社過出張中方法死深刻支店面件同転勤就組合集者持主建工事歴調整経営計日書家慣炊招清潔管扉糸修綿切習包丁読書飯器自宅住屋根裏部汚泥水道土配生地工理木中偶録策購疑謝現実然発言記化日広告付見出政世論読者礼認余地越避悔泣福奮慢屈乱嫌諦緊感情後大人的幸覚興我通運死退混表友張頑援令抗敬輩影響挑態威止来張政権求助支配独裁者命反的指示断非難尊語値先後若力老人悪戦度掘罠穴芝滝底沈煙突影性格的森林生根棒哺網巣双雄雌虎吠唸産乳動物類子進化恐竜祖先宇宙探検系望軌火星人天文学者惑家太陽飛行士無限船重力発射台遠鏡道工衛通信俺超奴微妙前兄姉奇跡獄聖墓的地書司祭使命感悪魔説教救神満希足重要不性価値地位権力一切望目標達成容似髪毛床屋美院人前黒白赤目立染合頬茎虫歯乳痛磨衛生士科医学繋了索換房込掲載掃除機電源接続動画終特定共有物形式的検変能開始冷暖設備読入力缶酢漬皮詰桃熱蒸気容器条雇択導賞満最低件報告書管理職用選場一割二十四内容使者訪問中予解指返信力早速話題寄付費警言仲喧嘩婦齢偏般憶衆婚約親恋人中付合間夫成年達未者高少女世代化様長次急速差別集団民族見種知一記力的大課児範幼稚板寮秀要素題童書囲段階的給食園正解公立私三学期制単位黒今校優賞章講演論集会大院堂問館内生飲処箋膚療癌呼吸効果的医師薬局方伝染性皮病力治法内科院溶較液参析仮酸傾比物質全体心理状態学固無色凍気混合考生命分証明説素記号種元類水資料起源作用向標準観察抽折才著創造幕吹奏書道象紙生花的能者性力目次天演技字楽器化粧誤謎適賢概極純粋璧解当集中暗記例不前真理意思上達伝想本気念完成性的実際結局昔忍紀昭江刀憲者戦後世発明見生出令和平成記念日自殺当時戸武士共産党持保障何年革命法君主国立英以前米領土杯酔麺華餃却日本酒居屋飲会乾二定食中一子返口券焼鳥後外没昇踏洞窟岩衝竹貝岸日出朝真赤夕焼暗不安定突大白海生長宝隠陰永魅冒騎幻箱現物遠力的険語悪夢体験石運命王座出会光景士空想道農畑穫牧穀栽培餌家作物産小麦場稲主要業用収量田温室委承氏率直助言幸員会認翻彙繰暢異釈致詞曖昧訳用語返学者定義習能力直接要約引流得言方誤解一活形動特徴容名頼倒積抑笑褒信用恐怖心裏切面快適好不幸悲支援極的消苦痛肉体顔顕透磁公式理科学者大過程限界微鏡図表明仕組度減引付導入石企請額稼資金新事業失中本大提供購入品物求書商店的代節約家"
        ],
        [
            "Section 5",
            "寸崩虹鉱崖前周囲絶滅自壊人類本能雑草熱帯魚的物化石属護徳倫盗罰依怪正義感道的公衆共理現場容疑者違反不利有証人頼代愉癖娯歓迎保証意地悪親友敬快人物頑固情告白味方失望感同印象楽困難場欲自慢的気桜咲梅盆狩晦幌待遠四季花見客粉症実家雨明屋台氷紅葉月陽気日光団子元正福袋大札"
        ]
    ]
}