{
    "name": "Words.hk Frequency List",
    "source": "https://words.hk/faiman/analysis/",
    "lang": "zh-Hant",
    "data": [
        [
            "Not in Words.hk Frequency List",
            ""
        ],
        [
            "Top 1k",
            "係我一唔嘅個有人都好你佢到就既咁會同大呢以得無要不可然去講過地但話多為出後自時下家上咗點又真之果知做生而啦日經住左啲中如面的咩心幾其成事想開所對樣喺己實呀文睇年用先只仲已學度最意當女於入再定嚟頭問見本是發港間來能行手因哋老邊仔解黎似分覺次返打冇嘢少香道前法完明身食者起理聲方埋全情正亦兩依即語野小國俾應落力叫三十阿諗至死現口相世望作咪公在聽識算友架今機水字嗰未天動走重加笑條種變緊通子將等高哈電外寫工或題更直他主晒二原陣氣太神路該第由書句感快竟始記反關部刻結新眼搵比了長放男位甚細信數乜番白平教班表場言名代夠界單常民性愛難登色說終林連令向回件清期企隻接認續搞西受錯四物低論何音車份化畀每玩候朋錢屋繼街失門近月政幫轉慢合東著體乎風影收任喇金離張拎美雖思安究線岩早根利流試提士從齊五例使司特留喎另活計此囉花讀半英鐘求萬深角處師差買非山突選光且目驚指海星品交內帶樂視被極決傳這容式殺義別步答立除粵廣詞晚總飯故市遠命持飲八也報類業強足進斷必圖鍾坐絕千程社百改保請仍黑媽首觀估謂員考啱簡精支跟底耐及歌易馬整㗎形格雞遊普戰母怪火王空需包況駛牙六區哥麼切愈畫台腦嘛撚基史亂確黃婆味樓初與功各紅推並滿制飛科奇量噉建隨排辦七城追響把佬價九輕盡資還運拍網客校篇術假拉鬼酒興節舊婚權爆治肯那段們照醫警達頂苦值止熱環禮片共產和沒青議急某調誠戲往示歷超古石眾念房腳則獨希展夜吓唱尾爭層球源圍標仆態靚投毒越堂靜親象送零執灣號痛紙醒換景證傾消啫概聞準較洲顯紀雙堆升府引看啊背冷套牛質系餐波喂血斯統習華演異勢病土院像存怕料維賣拖曾牌隊停楚舉巴集忍取藝短費袋約叔專劇麻忽服碼屌歲裝洗律局據票疑周爸圓級官派鐵便沙稱趣才嘩訓呼龍息島肉列傷破旅擇遲護她練謝釋順倒境裡管亞卡燈散聯熟聖跳案免梗淨評右喜搭告救兒責務南德承技職擊彩若廢惡察組些吹姐補痴唯煙願皮造印商規嫁揀暗典居設餘彈參溫北永般良室衝衫筆復介站耳隔靈魔掂敢索速領撞濟吸預避渣李陸哦堅詩團型導擔妹夢敗族遇畢偏嘴歡狗威退掛秒屬微銀待浪棄輪雨靠驗查米輸顧致備激朝際恐鬧魚否羅擺鳩廿負錄壓塔拜煩版臉陳充木貨炒歸討限修塊杯迫跌屎惜喊章貴雜置狂硬福元座懷戀粗慘股罪跑很燒茶弟抽添衰店兄密欣適沉配鬥壞伯模純妙毫豬偷研咧漢犯扮群捉努爛軍爾閒控創狀吧郁歐勝善尤養嘗談貼震尼智曲膠誤幸效炸富洋阻招園插陽髮拿守慣穿素融夾武訊透嬲粒育蛋刀封材鋪雲享具寶村略絲傻蚊休布勁草嚴射露判抗秘橋許害注里瞓途供暴編翻揮"
        ],
        [
            "Top 2k",
            "骨險借覆夫陰互尋父私乾劃鏡弱搖移批迷付嚇春祖澳減麵君闆肥優志盤禁降廁副按逐呆垃率嗎館圾忙贏赤偉油課兵唐肚探淚仁床虛臨廳碗郭製衣附庭賞久漫閉敬構戴烈益鬆默給吖蘭傅黨淡舞述霸助器辛施溝防潮帝陪毛播哲嘿申濕皇樹藍趕懶柱雄豆梁剩裏雪褲船亡旁脫財悲悶摸琛哂碌複迎括攻唉森宣幻抱觸危款缺閃忘咬秀範宗粉莫監滅佔徒灰咖佛尖尊巧祝扒漸圈憶獸勇廟藥須搶窗賽呃嘞曬嘈橫讓攞涼絡枝吃板沖端博咋宜童貌坦掌析殘田軟淺魂飾菜乘幕俗慮逢槍卻握牆嫲聚距鼓暫遺怒鑊鮮醉柒找穩築鄉忠奶游膽貓伊伸胸抵河鞋叻敵階側慶核窮譯增紹席測讚嘆盒厚奈混勞拳皆填操汗營秦遮織賭嘻兼宮楊甜幅緣尚涉固捨悔葉逃鼻挑鳥符啡健序梯訴甘辭凍瘋隱抹午嘉奮欲綠諸豪孩刺寧岸灘訪佈兜匯拒衛困洞碟含丁夕束罩舟郎'屍康拆佳嗚徑疊盛呵積薄粹竇煮掃策虎泛州幣折朗踢鎖啤凡娘揚跡韓串江蛇委莊輯怖托珠誰麥喝噴針擁憎劍夏徵浮省拋染珍媒韻剛恨末緒嗯怎眉載雷猶咯甩癲賤伴倫怨碎蠢麗劉伏恩扭抬屈縮賺逼哼搬着摩簽錫掉污稍潛裙塞藏臭狠榮餅艇儲審歉疫祈革塘憑秋胡豐鎮糖授揸映轟儀悉柴爲舒枱爽孤滯辯額描獻吞偶克爺納踏孫檔獲磨詳慰嗱滑咦后寒延滾績頸厭泥潭輩啖漏翼頓督掩醜暖陷均恥戶泰檯仙宇攬廈罰鼠扯抄撥晨膊潔戒斬罷喪牽聰琴冰嗌捱昏趁農哭億徹滴劈吉嫌巨檢池倍啟忌振猛甲痕襲誌闊扶吐慳傑註拼淫嘔租聊貢頁雅奧惑盲賴勸幼柔矛遍偽邪雀玉踩鹹牲攤沿癮撐犧玲截敏毀衡貪迴霧項顏駁掟廚塵替飽兇哀姑幹攝蓋誕憐坊湯炮累廂瓜抑啪唶凌旗烏蝕襯庸卷鍵篤逆妻膚墨悟櫃渡署腿干迅輔盾砌鴨橙勉咳壇暑曼肺亮懂扣泡諒箱拗腸乃獄獎糊誇障騎繁徐冠咀谷玻譬契奉婦季宿尿擾緩腰蘇姿杜損謀勵曆乖仇吊喉寄嶼爐荒違乏割協旨伙僅姓懼浸竹齋璃雕瘦賓劣叉旺菲裂症侶吾貫哩恭遞蝦哎抖糧脈糕个孔廉援箭舖鄭蟲閂扑偈京壯崩廠扎掣擦訂飄騰戚蘋戇採陶跪嬌丹寺巾憂晝窿餓勾匪仗崇唇敲濃邏頻煲彼捕糟輝匆塑壁湖郊酸擠冬梓臂粥穆殖鋼帽紛競綁斥熄域廊慌擴獅譜掙梳妖奔循欠湧漁災縱繞銅鳴曉植耶氛娛鬚憤哪籌閘鹽搜閱蹤辜寂恆旋睡稿曰嫂嬅氏洪撳奸屆剪勤拾搏遭鳳喻謙俊奪惠慧茫盧釘焦藉央詠云歎叮坑奴拱津爬纏誘框獵鑽訝欄歧淋診療鋒侵冧剎撲暢涌辣冒劫坎宙尺斜棍熊窄紫繩蒲姻患腐鬱睛倉徙衷齒袖檸攪螺押宅擰禍荷澤薪孝灑炎臘魯催礙罵胃躍餵湊筒揭脾恤鄺井促晏祭賢頹斤捲仰匙噏愁朱迪諾諷刑奏憾尐亭冚晰笨蕩陌隆棟啞眨壽峰幽掘泳疏矮紋舍鍊妝柏臣皺庫欺洩芒趨窒郵彙棋宵碰譽黐殊辱毋液堪愚蓮籍蜜乞售擋歪稅葡裁覽礎"
        ],
        [
            "Top 3k",
            "悅役脹桶磁吳罐龜撈俱孖浩旦猜貧慾弄准堡攰暈疾屙丟喃彷址捐梅矣賊購銷髀汁敦喘彎拔摺矩舂豈遙姊棵妥誓妄脆仄礦芝諧廷趙予措艱匿穌稚呂宋嶺渠狼羊遷寵寬舌凝彌擬盈籠脷驅鶴冊乳姦卑瞪盃丸歇泉渴籤軌週騷薩齡薯販咭董傲妨肆蒙鄙咒沈賠漆盟娜閪卜坳埔寸淪脊撻垂紮籃巫挖氹翁脅跨侍余厲鬍召滔丈燭潰呈眠埃誼疲厘刊吟慕斗淘漠煎碑蕉裕葬頌捧秩慨培悠笠謹邀隧濫娶債桃殿腹航褸辨滋吻踐竊軀肩凳抓瞬晴浴盞窩耗貿冤乙嬉傘償凸囊坡瑪筋萄俠裸繫逝伐勒啩姨宴崎弊恰愉愧懸挺繪芳貝鄰罕潤羞噹邦耀芬袍尷鷹泣衍肢虐它揾稀蒼鈴丫勿慈懲棺涯撒榜聳朵牧邁溶梨侯呻墮揼殼泊腔詢貶巷彿尬哇酷駕屠賦螢嘖劏奢樽盔鏈挽儒剷贊燃逗惱嘯漂豫响墳昂焉焗肌艾軸洛嘲懇磚嬸嘟屁鑼券棒拯刪崗慎撇犀紗采塌仿陀劑械帖撕奕捽儘嘥惹茅顛呎蓄拘煞糾佩焚昧魄囡瞇夷鄧鯉綜蒸祥謎晶嫩倦禾虧喚牡扁漿佐丑騙晃鯊捷汽沫碧藤謬蹟馳驟託撼詭叛刷骰噓蕭剝埗憲披挨盼籬豎蔡寡杖縣僱擲爪撫錶胎炭噢卒帳摧渺漲酬釣鑿筷銳潘椅宏征昔暇椒綱苗馨鹿倪匡勻蘿竅銘茄屢寞簿凱鉛妓羽甴鈕佑卸恢松櫈滲煥蹈錦匠涵澀贈醬悼屑懵曱詐豁咸凰屯斑枉毅窺胞袁鵝緻奄瀆履枚餸刮櫻魅隸琪噬弦唸嚨湘孟燕苑蹺岳哉孕瀨恒翅蝗樸欖狹盜躬頗抒脂喱吼彭墓弓惶斧犁癡蠟闖衞鼎戈畏癌苟擅韋疚粟賀譚旣嚿巡枯淆竭箇縫羨膝蟹颱昨倡龐蔥蛙挫昇吱਋馮怔舔韃撤燥砂磅稽簾跣鴻肅蠻榨睜裔潑沾霉撩琦涕瓊瓦睹綿荃腥爵勃愕霜豔鞭檬媚莉乸扇棉腫腩僵岌堤斟灌狡綫纖蔭蘊蟻匹摘瑰侮鞏国墜嚕陋贖齣揹荊唏圳伍僻叢崖惟玄羹茂蠱ࡁ繹俄駐屏柄瀉篩薦囚菌噃菇哄臟耍㖭簫傍坪川朽澄瀾珊瓶紥缸腕躁逸撮疇倚掀寓削膏賜輿牢碩耕軒搓曹遣淒嘶燦膜睬⼈兔塗怠桑綑臺莎鍛廓膩謠僕嬰吋赴渾墊煉眶伶犬嚮覓婉昭恃襪蕾懦俯哽岔巢罅耷鞠骸吵鑑殉曠赦玫禱樑柳膨鴿鍋拙擘姆沮汰什唞攔攜溜禪蟬邨紐煽瑞萌赫剔襟刁唧占拐兆樺壟妮敷咕糭囂蜂蝶鈔悖捏逕凹併葛亢滄兮卦恍悄恕鈞慄堀曝桂棚淇滘熨狐穢葵霞寢豉瞭薛遵傭砰貞倖凜薰瞞繃曖盂瘡誅睄阱泄邋偵珈訕笛卿怡戥暮熔祠肝顫僑宰荀熙柯蓬御秤鴉咽啼焰殷孽癱黏痾晦兌惺僭嗲侃彤喼瑤唻擒甫眷綻蛛霑擎釀遜輾頑夭晾蔔籲庖蒂穴遁袱昌惰叱哮瀟雯呯嫖兢哨棠苛蹄閣頒啜拓肋羣矢餒捍凶娃爹杰帥聾駒晉巔訣穎矇銜癢遢摑菊淑忿靡羈搔虱喲墩攀爍瞄禽纜翠褪陵鯨芽壘橄撰搗冥盆駝彰慚搽炫倆扼耿妒瑣妳廖蒞崔舀枕檻瀑猖耽艦隙頰鋤啓弗啃砸閩酋兀嘰燶聘嘍惘懈狙廝斃昆飢斂刨掹喔証頡丙幢捌檳徘淵熬睫肇蔓轍逾敘挪㩒岡曽瞳茲濺瘀憫聆欽賬摔函"
        ],
        [
            "Top 4k",
            "喧暪獰伺帆徊抆掠沸溯烤眸碉祇綽蘆虹閻鞍顆髓噸允竄駭濁拮翌肖噁紳夥搣姬寥攏鑄噪怯嗡琳濾咐霆嗜俏嚼逞浦莞嗄僧卅擱栩梭楓瀝猴瑕瓣畸笏筍荔衹辰沽躲霍祀屹跛毆攘踎迂虔傢躉駱朕洶縛萎琉癩薑餃癖汪畜睥杆菩蔑懺溺謊鈺于螞寨豹禎姣桿鮑咆拚晌躇躊墟壺孭摷溢狸獗蠔靴龕埠驕瓷炬詮曳婿馴醋温汝瘟遂奀霾箍霎綴亨氧沐吽嗤翩嗽嗒吩伽盪岑几盅彥盯噗莓賂匸昷栓剃峽庇杉汲淹炳絮翔肘葫蝴醇鑣闢靶幟碳諺鋸辟媲駿魁吏瀕呱萊娟鐧烚匣揣疤汶蠅歹憧侈惕敍棘瓏痰抨蜻漓鴛吠喳帛拂蕃冗糉豊圭咿羮祢嘎僥刃剖噚嚎塱壩峒峻濱灶盎砲蟧蠄豚闌禧咎崛贅菠牟蔽衙矯奠鏟鋁冕遑楷迦蹊瘓潺芥蓆朦稻虞憬卓尹炙猝緬蹋毁膿唓揪擂琼猥鴦翹噩勳猩胭燾燼炯ࠒ腆藹躺窘捺毓⼀堵桌溪瀰狽瘴磡逛醮閑霄頃穀摯菱芻峯誦肴裹饒煌捅殆槽慷叭摟瀧厄哣悵襄釐祿嚏譴闡蜓庶朧栽扳叶灼嘭揖剋鵬弧瑩鎚囝蜢鴇壤寮徽榷槳汀沛濤眺賈鑲飆饋ࡃ孰戎誨宛蒜諫輒渦鏽俑囑僚籟沌酌倭諮絞簇翳絨萃唥臆鑾饅濡諱靖薇閏摒栢吔歛埼尸佣嗟仕瑜腑瀏煤喬吭嗨涎霹靂靦偕悚惴鏘咨詹咔鍚鏢謄弘梧榴橡甕甸畔瞻穫罟趟踭飼篷訶壹氈悍澈楹貸賄乩臥翰澱糙蜘烹蜑棧熾吶喋訛倔卵蔗謳逮垣誡梘蔣繡尉娥諭矜姥啐呸囍詫杏囈褻痺芭賒呷棗腮坤实敝樁硤撓蕙腍驃抺䃟划噤奬寅湮濛疵瞰祕禦稔荼螂詬蹂躪轆雌馭骼鶩緝嶄烘楣骷髏孺蜒掬丘艘倘杭砒槌旱砍艷鼾鉅曙顰羔詡腎腺恿慫絳棕嗇轎冶窖疆麟拈惋憚滌蓉褒蹶逍錐髒鱷淥佇罔胖姪孚楝藩踵燙禿瘤愣咤虜釁秉拭会槓佻墅璧嬴緋范嚓娓揉唪劌姚熒叨唾娼株瑟絶羌趴騮驀芹枷穹輻縟糯俐囪踞廬戌札歟殯轄塚搪竿軚酵瀡餡梵凋恙皿募拷婪篡緯嫉潦鱗稟詣徨漩疼磊嚥囤朔殞膾韜饑傀儕儡撿癥汾慤啄悸鉗臻脯浚鑒杼砵暱舜俚膳寰榕諜隋吁氮࠺舅为嫵您攫蕪鏗嫣惻涂悴憔鬈庾沓勺乍垢峙嶇戙抉燊稜笙箏紓縷繽訟踱錘髻黯噱嚐淮棲醃陲蜿弒繳卉謔梟贓戊紆逅榻俬揩嗣芸莘仃捩嘸戮巉殲轅遼琢脚阪奚箕癒儼冀痍莠蝙蝠諉咇曦啷撬釜辧殃抌倩黛渲趾剿殭俘犢内詁挾濠滸魏銬嫦両惆浙籮吆瞌蛀儉婷綺嚷嫻巍愀戾掏时柚泱澰睽袒詆长汨膀騾蔚恁忡咏澎葆咄躂佼攣粼氯囿妞弩桐笈篙紜莽萍蛤衆陡駅鯽擸枳敞櫳誣驥矽締哺祟馱錮甥茹旭詔雛牀耆遏酗趷埞拌孱蜃韌呔嵌桔煨鈍㨴媳涅燴徬嘜泌炆驛骯髯堯糞ࠝ龔諦嶽殻黄暨儂彬鐡漣漪瞥迢縈么焊佮儈詛翦俎咚蠍澧蕊筵諳邂乒乓丞夌鎗埲銖㷫蛾鼆簷邑蠶闔匍匐幌獪簸螻賅軑圜栗体彊憩抿淤璞给话軋进驢鬢唆氓噥憊汕痱皂譟酥嗦郡貳侏羚噠鉤喙奐巒巿帑强撑檐漕澗瀚瘁礡纓芋苔薈蜆跚蹣輋雁鱲鵰ࢃ橢狄饗樞麪輟鱉恪沃鹼"
        ],
        [
            "Top 5k",
            "芯涓鑰狩腌户褥笪忖烙艙࠵胯鳶躋挈籽冽匱拇閹纂霓邃氾拃諄窪恫炷喀茵璀璨関嘮幡攋藕瞎揦蹴耘儆拑攸沼点譎銹沬絀两垮岁菁鹵嗔駢万忟翊ㆶ礫跎怵肪餚隕弛疋膺磋蜀掕妤辮仝唚燉倌妍戳烽瀛鈎鬨恵厥飴曇匾扔聡卧鞘臍釵劊縹黝睿窟忪鉸叼啕噫摵擻瞼誹謗孜誒輛吝猿枴卍对帚悽愴摶无泓漉箸糴耑謾评语貅貔还冢帕彪慵搐椰潢膛蚓蚯賁鎊鶯奎嬤应楨祂翟酣敎縐躝ࢲࣲ煇臀岐湃熹籐絆舐轔閨秃肓揈莖猙卽藺哧蹦⼤⽤嚶侷咫孵巖弔徠扽暉滂牯璽砭綢繆舢茜蒐蛟螳髹鷄竽猷穗鎅稷踊遽峭夙焫僮劾庚扈杳殮灤絹迄竣掗鍍銃矗懾絢込陛閥柺綵胳矚蔬漱麾甬芫溉牴湄啾噌筲蝨鱔鷂祉譏迥吒夯擢炕硯綸芙覷闕驊旬虫踰凈煒譁翎ㄎ侗硫蹉錕衊叠欸鸚緹鍥鰲箝喵懊櫥霏魷遐㨢跋魘洽暄泵阮髦広辞紂宝慟錙咓嗶写鬯滓熏踪咱湛坷媧睦遡緲隘鵪鶉噯畿眩眯様竪颯憨众匈叙圏寇忐忑搁摹泪睨稠紕终脖膶藻褐见记难东丽嗓宦揄揶氰洒涸簧酲阡シ们偎华发喏愿戛煬现紧该俳呤唷徂癐裇藐邯鄲喫翡罄胴伕麓没崳捻泯苞鳯韶怦蚩讖醺尻囁捶咃哆騸剥徛眞尴岀囖莅矓駄燄⾃⾳啵溻翕嚱膞仞僊剌勘堰岬嶂巗怱抛朶沱澇瀅炊瑚纍罾袤説踴錨騖鷗ࢯ橘葺鐮迭涇渭驍謁豢伇埶邇閡壅氤氳獠瞑禺胥褫蹲鸞耄耋妃漬痹㧬罌皙娑繚粕婕薊荳韮眈斐缽唂昕愫桎梏黹佚啅焼櫚冑犄盦埈壑俺凪摏燬姜驪侲橛毽舵蘸麒ࡁ臃鵲騅鯁祐舛倀区恋戟揑磐絃继续裨伎裱号图怜懃縴鸡叩佘旻隍庵葩嚡ㄌㄚ扤恬愎紊隅騐醞扚驄鵡嗬冼儍弈縝啝睞菀来渙醍醐愜硝髪漾酊酩桀蛻綾姍餬孮沆砥騁潚覇椎檎韁㦸亥鰍皈礼虯軾酪滬齌掐緘扉槃俸餉ࡁ跤夸浹忤恣捋禠渝窈窕丕妾愾摀嗆嗝瘠皚繭臠顎珞瓔詰皓茁椿韭颼嘀嘚禀习书乱从价势叵叹员啻带张揺搥敕晢晩极樫残氫热牘牠独獷癟瞧祺笔箴簌荣蔻裘裴覲觉认论踮鈿随靄鴕偌决匕啥懍掰擄杀杞檜气漒瞅緞纷罹虽观赛赞遴錚银齏齙ホム业偃况办囌坂声妁护捜机毕洙灯窓经让蹓这鐳餾丐哘扱揞搦擳珮碇礬筱篱菓赢躹鏖飊࠾ࢳ࠻亍彳焯樖頽叁昩弭甄軻࠽溏琵琶熜焙尢媾孻氖溥蟆ォ攙魑蹩紡喁甌㕭嗅瘍胱羡槐邱涿蝸撘鯇傞摭杷屄涔燠愨㗳欶懕捃槪滕澌砐谂閙蹭厠摞燻薜崽寐忱淳糹肨芩飩嚹孥噖譭瞟墈撂狏珏緅骹悻嚅挒濂肛戅⼊⾒⾮⾯旮旯繑洱逄鯪骴捹粘餩朴滷孢侖円劬匝圃埕屐崢嶸撟柢毬汐汚淼秊窰纒舨莆菍豺酙鋰雍頤寜稈筳饌輓鎬爓狎羸鲁澹蹞駑喐嵐旃檀爇琤癰砉禳縊訖詈誶讞邸闥帮厓粿罉拝蜍蟾紈絝㝝嬋衩鄂搲荽刋澡祚腓赭亶斡畋褶訥鏤悪曜気秏茨辺芈塡螃餼࠽垓禤茴謭汞猾稳胜设鏐阶项蚺䕺聶卫坨妊娠学庆褂掦ई毘纈竉髺鯰筠酉鋈詼佗ㄏㄝㆴ㤇唨緙虢迆磺甦掖緃踨䅲瑛皃"
        ],
        [
            "Top 6k",
            "盍辵贍蹝俹簁紉芡鎂ࢭ亲冲吡弼袞嗻懿徇嫰歃ࢱ嫗暏葭蒹珀琥壬恴燘鸛淩痢笆颶顥黌囹圄瀸燎礪艺鵠熵杠氟銼鰭灸効硃侄碴誔蔃减戯湾綏脗㾻咑瀲灩睺蟠ࢴ訏唁邵卯佃鋌倨酚痊諎蕞参聴喞窯羿誑墻濯鷺棱軼韙罊࠺挲鴆篸鄒鄹臾剮嘷媛峋嶙犲猢猻糅縻峴毗蟄掔盹蹙霽玟兀隷摻觴棹櫫佞曚癇洳澪飪黷蒿踝呑娉婀嬈瓠螓仨儿关吮埸墾壴妣将届属岂岫岱帐录忒忧忳怀总悌惊戍戕捫掄显晓梆楞殂殤毌沏瀣状瑄疴眢碍聒腋腴节荡蘑蚣蜈装襠襤諂諛诛说请谐豕貽质踁踘蹹车远连邓醴鉴錡鑠针钞问闹阁险霪预题风齜击奥妲廸枪样檄潸环称约翥获菅覤訐貂资踉蹌軏运选错间雹韲顱ェオャ义亿兴冏吂听场坚复奋寻岗广开异弃归惦懨拥旌暁枹梢梦济灭爱縶线细结络绝联胁苯茱萸蜚裳諢证课贵轨适逊醛释鎧鏹霖顺馈騭鱂鲘麋黍㨂䓤丼乭偲幔涙産穞窂肶艮萱蔴蠓陞ࡲॄਈਤ௣栞囗㗰磯刎啋婊驘糠褚廛曩毎茉町亟玖餞迹擤価値変幪観畨惝榭滇簪绮鞦韆顔鵑洎洵茍讒彚樵擗狪駙鐸麝耒࠴瞽葯㰖嚢婢徧懞虻蹀躞掤孛獃闗粽贛蟑蹇チ伝澆蔦魍魎憟删痘剽宄槎灞畝睢粱粲罡諍賸逋郢鄕鋏韉䟓勛堊彗楔槤瀘鏞麈蚤欧頼脇蚍蜉鏑跆煜崑刧埇鮫嗩痙褊睩雒㨃䜙獳矖袂謷逳净浓粤级讲阵鈣癆蠆貯絰摙焮哟呮嘑妗罸佯俞璣謏鎩麽齟齬嗮巹祁膈鯹挅柸幀拄蜷塢啉胚僆嗉昅卌趺躑礴噝壆孑怙悛捂旎旖猄笫篋躀隼顴黠幃枇炖疙瘩笳靨傣嫡睼झ暝柿嗥烟鎢驁鰂砧鎯鐺刄峇濘孌朣沢癦簣鈾埴禹糜蕎滙⺟⼆⼝⼰⽂⽅⽣⽩⽭⽼⽽⾄⾏⾸⾺亱凖嚫并徼悞箋纔视縄掁࡙淅攢糍綳窝鰥燜哐揜撠舳艫踼煁簋譖圑嬏柑礁緑縁罨録瘌嘓噣樟閤餿呌屝涶癊魴鰻挷枭渗傚孿磿昺毯蛆寛檷"
        ]
    ]
}